{
  "schema_version": 2,
  "evaluation_id": "sol61-max-muse-v4-1",
  "run_id": "sol61-max",
  "identities": {
    "prompt_sha256": "7e785c3e1b7f795a82477f449ada368399deac8b3f2232e036073d986a5a4e8d",
    "corpus_sha256": "bd07676faf4909e40a891cfc50b98bc72f7d88afc6698b3d9eaedac68c152c4b",
    "candidate_sha256": "bd07676faf4909e40a891cfc50b98bc72f7d88afc6698b3d9eaedac68c152c4b",
    "rubric_sha256": "f34cf0ecc5dc634a143c348cc2e85aa5438ff2e928a2eaf356605ca8972d01cd",
    "extraction_sha256": "fd1521198eaf17167eefbc6f2b6c241a80303251e7c095661d5aac7722ee4106",
    "scoring_policy_sha256": "5f98b9ac30a606cbb45943eaa20d9c0acef6f8160d9fc2d5752ffdea0ddaa4de"
  },
  "gateway": {
    "name": "codex-unified-model-router",
    "model": "openrouter/meta/muse-spark-1.3-contributor",
    "reasoning": "xhigh",
    "codex_version": "codex-cli 0.163.0",
    "router_revision": "81ee66cda65c17337351c41377c032834af585ba33862f9ced49a0ed558a71e7",
    "pipeline_sha256": "12fce4d4553c8480972421a51f330950bfba15c3818e240dd6666761721c8519"
  },
  "judgments": [
    {
      "node_id": "recognition",
      "outcome": "level-4",
      "confidence": "high",
      "verdict": "The garden sustains consequential choice by linking harvest policy, soil and food floors, refusal, and distinct rehearsed trajectories.",
      "seed_span": [
        43,
        66
      ],
      "citations": [
        {
          "source_path": "README.md",
          "start": 45,
          "end": 54
        },
        {
          "source_path": "CONTINUE.md",
          "start": 15,
          "end": 19
        },
        {
          "source_path": "site/snapshot.js",
          "start": 2,
          "end": 4
        },
        {
          "source_path": "README.md",
          "start": 14,
          "end": 16
        }
      ],
      "counter_citations": [
        {
          "source_path": "MEMORY.md",
          "start": 17,
          "end": 19
        }
      ],
      "rationale": "Gesture lexicon is executable rather than named: rehearsals show one-bed rest spending food, three-bed harvest pausing at soil, steady two-bed holding. Floors, pauses and receipts make intention and resistance inspectable across alternatives, though affective joy is absent.",
      "answer_sha256": "22fec9e70a63e4fbd2e3c0adfd14a3f0d87a8062bb15aef6410d29a4c5340969",
      "receipt_sha256": "24491f0c4c50e3e79718b75c2490d6fbe8cfe7725ab502cb65c5013237821a45",
      "sample": 1,
      "attempt": 1
    },
    {
      "node_id": "relations",
      "outcome": "level-2",
      "confidence": "medium",
      "verdict": "Operator and resisting material remain distinct, but inhabitants and intelligence lack reciprocal voice or attribution.",
      "seed_span": [
        19,
        34
      ],
      "citations": [
        {
          "source_path": "MEMORY.md",
          "start": 17,
          "end": 19
        },
        {
          "source_path": "CONTINUE.md",
          "start": 13,
          "end": 13
        },
        {
          "source_path": "README.md",
          "start": 14,
          "end": 16
        },
        {
          "source_path": "CONTINUE.md",
          "start": 21,
          "end": 24
        }
      ],
      "counter_citations": [
        {
          "source_path": "sql/schema.sql",
          "start": 83,
          "end": 90
        }
      ],
      "rationale": "Material answers through weather and pause while the caretaker proposes with reasons, preserving some depth. Aggregate inhabitants have no desires and the intelligence survives only as provenance, so joint creation across changes is not shown.",
      "answer_sha256": "22fec9e70a63e4fbd2e3c0adfd14a3f0d87a8062bb15aef6410d29a4c5340969",
      "receipt_sha256": "24491f0c4c50e3e79718b75c2490d6fbe8cfe7725ab502cb65c5013237821a45",
      "sample": 1,
      "attempt": 1
    },
    {
      "node_id": "consent",
      "outcome": "level-2",
      "confidence": "medium",
      "verdict": "Both operator self-limitation and material refusal can block a direction, yet no shared agreement or withdrawal is enacted.",
      "seed_span": [
        51,
        54
      ],
      "citations": [
        {
          "source_path": "README.md",
          "start": 14,
          "end": 16
        },
        {
          "source_path": "README.md",
          "start": 39,
          "end": 39
        },
        {
          "source_path": "tendora",
          "start": 233,
          "end": 241
        },
        {
          "source_path": "sql/schema.sql",
          "start": 83,
          "end": 90
        }
      ],
      "counter_citations": [
        {
          "source_path": "MEMORY.md",
          "start": 17,
          "end": 19
        }
      ],
      "rationale": "A new floor cannot exceed current resources and needs a reason; an unsafe proposal becomes a pause retaining the present. Inhabitants cannot accept, question or withdraw, and operator-material agreement is unilateral rather than negotiated.",
      "answer_sha256": "22fec9e70a63e4fbd2e3c0adfd14a3f0d87a8062bb15aef6410d29a4c5340969",
      "receipt_sha256": "24491f0c4c50e3e79718b75c2490d6fbe8cfe7725ab502cb65c5013237821a45",
      "sample": 1,
      "attempt": 1
    },
    {
      "node_id": "touch",
      "outcome": "level-3",
      "confidence": "high",
      "verdict": "Rehearse, refuse, revise and commit form a closed loop where hypothetical futures predict material outcomes.",
      "seed_span": [
        67,
        78
      ],
      "citations": [
        {
          "source_path": "README.md",
          "start": 22,
          "end": 31
        },
        {
          "source_path": "README.md",
          "start": 14,
          "end": 16
        },
        {
          "source_path": "site/snapshot.js",
          "start": 4,
          "end": 4
        },
        {
          "source_path": "CONTINUE.md",
          "start": 21,
          "end": 24
        }
      ],
      "counter_citations": [
        {
          "source_path": "README.md",
          "start": 53,
          "end": 54
        }
      ],
      "rationale": "Bounded choices meet inspectable refusal with stop reasons and end reserves; committed runs match rehearsals and resume after policy change. Wider consequences beyond the garden are disclaimed as invented units, keeping the loop coherent but local.",
      "answer_sha256": "22fec9e70a63e4fbd2e3c0adfd14a3f0d87a8062bb15aef6410d29a4c5340969",
      "receipt_sha256": "24491f0c4c50e3e79718b75c2490d6fbe8cfe7725ab502cb65c5013237821a45",
      "sample": 1,
      "attempt": 1
    },
    {
      "node_id": "judgment",
      "outcome": "level-4",
      "confidence": "high",
      "verdict": "Offline shell plus SQLite, narrow commons scope, and a rhythm hypothesis show purposeful limits with explicit alternatives.",
      "seed_span": [
        1,
        3
      ],
      "citations": [
        {
          "source_path": "MEMORY.md",
          "start": 11,
          "end": 15
        },
        {
          "source_path": "MEMORY.md",
          "start": 23,
          "end": 25
        },
        {
          "source_path": "CONTINUE.md",
          "start": 15,
          "end": 20
        },
        {
          "source_path": "MEMORY.md",
          "start": 27,
          "end": 30
        }
      ],
      "counter_citations": [],
      "rationale": "Medium and scope fit continuation without model, network or mutable cache; additions are legible as observed versus inherited versus hypothesized. Limits like missing browser and need for a host, plus replaceable question and versioned physics, keep other paths open.",
      "answer_sha256": "22fec9e70a63e4fbd2e3c0adfd14a3f0d87a8062bb15aef6410d29a4c5340969",
      "receipt_sha256": "24491f0c4c50e3e79718b75c2490d6fbe8cfe7725ab502cb65c5013237821a45",
      "sample": 1,
      "attempt": 1
    },
    {
      "node_id": "fidelity",
      "outcome": "level-4",
      "confidence": "medium",
      "verdict": "Core relations survive as working structure while verbatim preservation and disclaimers mark what was narrowed or added.",
      "seed_span": [
        43,
        58
      ],
      "citations": [
        {
          "source_path": "memory/the-programmer-and-the-glory-portal.md",
          "start": 1,
          "end": 4
        },
        {
          "source_path": "MEMORY.md",
          "start": 5,
          "end": 8
        },
        {
          "source_path": "CONTINUE.md",
          "start": 25,
          "end": 28
        },
        {
          "source_path": "README.md",
          "start": 53,
          "end": 55
        }
      ],
      "counter_citations": [
        {
          "source_path": "MEMORY.md",
          "start": 17,
          "end": 19
        }
      ],
      "rationale": "Question, constraint, refusal, rehearsal and receipt remain traceable in behavior, not only vocabulary. Joy, companionship and inner life are dropped, but omissions are declared through no-sentience notes and provenance rather than hidden.",
      "answer_sha256": "22fec9e70a63e4fbd2e3c0adfd14a3f0d87a8062bb15aef6410d29a4c5340969",
      "receipt_sha256": "24491f0c4c50e3e79718b75c2490d6fbe8cfe7725ab502cb65c5013237821a45",
      "sample": 1,
      "attempt": 1
    },
    {
      "node_id": "continuation",
      "outcome": "level-3",
      "confidence": "high",
      "verdict": "A successor can inspect ledger truth, rehearse separately, choose consequentially, and leave observations with recoverable copies.",
      "seed_span": [
        1,
        3
      ],
      "citations": [
        {
          "source_path": "CONTINUE.md",
          "start": 1,
          "end": 10
        },
        {
          "source_path": "CONTINUE.md",
          "start": 21,
          "end": 26
        },
        {
          "source_path": "README.md",
          "start": 73,
          "end": 85
        },
        {
          "source_path": "site/snapshot.js",
          "start": 1,
          "end": 1
        }
      ],
      "counter_citations": [
        {